{
  "protocol_version": "gm.node.v1",
  "claim_id": "clm-public-sync-0001",
  "assignment_id": "asg-public-sync-0001",
  "node_id": "node-0001",
  "claimed_at_utc": "2026-04-20T09:20:00Z",
  "claim_ttl_minutes": 15,
  "status": "completed",
  "note": "Reference node completed the public-state sync and left an append-only claim trail."
}
